{
  "schema_version": "2.0",
  "video_id": "epfl-parity",
  "episode_content_hash": "8cc669a08fcea2fcb9df663faeb5bfa9a71edd184bcbfd8aef90eba7bcc0fba1",
  "frame_contract": {
    "fps": 30,
    "width": 1920,
    "height": 1080,
    "interval": "half-open",
    "clock": "frame-derived"
  },
  "duration_s": 599.996,
  "composition_count": 24,
  "meaningful_state_change_count": 115,
  "scenes": [
    {
      "scene_id": "s001",
      "chapter_id": "c01",
      "composition_id": "cmp001",
      "purpose": "Advance hook through an inspectable state change.",
      "start_s": 0.0,
      "end_s": 31.118,
      "beats": [
        {
          "beat_id": "b0001",
          "cue_id": "q0001",
          "start_s": 0.0,
          "end_s": 4.841,
          "primitive": "transform_compare",
          "visual_system": "circuit cone",
          "entities": [
            "EPFL parity result",
            "ex-circuit-cone",
            "instruction/operation equality mechanism"
          ],
          "state_change": "The opening question replaces the title while the worked example remains dimmed.",
          "claim_ids": [],
          "evidence_status": "conceptual"
        },
        {
          "beat_id": "b0002",
          "cue_id": "q0001",
          "start_s": 4.841,
          "end_s": 9.682,
          "primitive": "transform_compare",
          "visual_system": "circuit cone",
          "entities": [
            "EPFL parity result",
            "ex-circuit-cone",
            "instruction/operation equality mechanism"
          ],
          "state_change": "Trace cue q0001, 'What happens when the strong comparator has already captured every associative merge…', through circuit cone while the label for EPFL parity result stays attached to its layer.",
          "claim_ids": [],
          "evidence_status": "conceptual"
        },
        {
          "beat_id": "b0003",
          "cue_id": "q0002",
          "start_s": 9.682,
          "end_s": 15.041,
          "primitive": "transform_compare",
          "visual_system": "circuit cone",
          "entities": [
            "EPFL parity result",
            "ex-circuit-cone",
            "instruction/operation equality mechanism",
            "preparation penalty"
          ],
          "state_change": "The thesis appears as a single claim beside the episode map.",
          "claim_ids": [
            "circuit-cone-support",
            "epfl-mechanism",
            "epfl-parity",
            "epfl-preparation-cost"
          ],
          "evidence_status": "confirmed"
        },
        {
          "beat_id": "b0004",
          "cue_id": "q0002",
          "start_s": 15.041,
          "end_s": 20.4,
          "primitive": "transform_compare",
          "visual_system": "circuit cone",
          "entities": [
            "EPFL parity result",
            "ex-circuit-cone",
            "instruction/operation equality mechanism",
            "preparation penalty"
          ],
          "state_change": "Trace cue q0002, 'This episode has one job: On accepted EPFL AND/INV cones, CSE-flat already captured the…', through circuit cone while the label for preparation penalty stays attached to its layer.",
          "claim_ids": [
            "circuit-cone-support",
            "epfl-mechanism",
            "epfl-parity",
            "epfl-preparation-cost"
          ],
          "evidence_status": "confirmed"
        },
        {
          "beat_id": "b0005",
          "cue_id": "q0003",
          "start_s": 20.4,
          "end_s": 25.759,
          "primitive": "transform_compare",
          "visual_system": "circuit cone",
          "entities": [
            "EPFL parity result",
            "ex-circuit-cone",
            "instruction/operation equality mechanism"
          ],
          "state_change": "Prerequisite nodes light in the series map without replaying their lessons.",
          "claim_ids": [],
          "evidence_status": "conceptual"
        },
        {
          "beat_id": "b0006",
          "cue_id": "q0003",
          "start_s": 25.759,
          "end_s": 31.118,
          "primitive": "transform_compare",
          "visual_system": "circuit cone",
          "entities": [
            "EPFL parity result",
            "ex-circuit-cone",
            "instruction/operation equality mechanism"
          ],
          "state_change": "Trace cue q0003, 'We build on Why scopes and boundaries matter, Plain CSE versus sharing-aware CSE-flat,…', through circuit cone while the label for instruction/operation equality mechanism stays attached to its layer.",
          "claim_ids": [],
          "evidence_status": "conceptual"
        }
      ]
    },
    {
      "scene_id": "s002",
      "chapter_id": "c01",
      "composition_id": "cmp002",
      "purpose": "Advance definition through an inspectable state change.",
      "start_s": 31.118,
      "end_s": 59.021,
      "beats": [
        {
          "beat_id": "b0007",
          "cue_id": "q0004",
          "start_s": 31.118,
          "end_s": 35.959,
          "primitive": "transform_compare",
          "visual_system": "support trace",
          "entities": [
            "EPFL parity result",
            "ex-circuit-cone",
            "instruction/operation equality mechanism"
          ],
          "state_change": "The plain definition replaces the question and its key terms receive labels.",
          "claim_ids": [
            "circuit-cone-support",
            "epfl-mechanism",
            "epfl-parity",
            "epfl-preparation-cost"
          ],
          "evidence_status": "confirmed"
        },
        {
          "beat_id": "b0008",
          "cue_id": "q0004",
          "start_s": 35.959,
          "end_s": 40.8,
          "primitive": "transform_compare",
          "visual_system": "support trace",
          "entities": [
            "EPFL parity result",
            "ex-circuit-cone",
            "instruction/operation equality mechanism"
          ],
          "state_change": "Trace cue q0004, 'On this AND/INV workload, CM and CSE-flat had equal instruction structure and measured…', through support trace while the label for instruction/operation equality mechanism stays attached to its layer.",
          "claim_ids": [
            "circuit-cone-support",
            "epfl-mechanism",
            "epfl-parity",
            "epfl-preparation-cost"
          ],
          "evidence_status": "confirmed"
        },
        {
          "beat_id": "b0009",
          "cue_id": "q0005",
          "start_s": 40.8,
          "end_s": 45.641,
          "primitive": "transform_compare",
          "visual_system": "support trace",
          "entities": [
            "EPFL parity result",
            "ex-circuit-cone",
            "instruction/operation equality mechanism"
          ],
          "state_change": "The controlled term AND/INV cone joins the persistent glossary rail.",
          "claim_ids": [],
          "evidence_status": "conceptual"
        },
        {
          "beat_id": "b0010",
          "cue_id": "q0005",
          "start_s": 45.641,
          "end_s": 50.482,
          "primitive": "transform_compare",
          "visual_system": "support trace",
          "entities": [
            "EPFL parity result",
            "ex-circuit-cone",
            "instruction/operation equality mechanism"
          ],
          "state_change": "Trace cue q0005, 'Watch for the label AND/INV cone; it stays attached to the artifact this episode means.', through support trace while the label for EPFL parity result stays attached to its layer.",
          "claim_ids": [],
          "evidence_status": "conceptual"
        },
        {
          "beat_id": "b0011",
          "cue_id": "q0006",
          "start_s": 50.482,
          "end_s": 54.752,
          "primitive": "transform_compare",
          "visual_system": "support trace",
          "entities": [
            "EPFL parity result",
            "ex-circuit-cone",
            "instruction/operation equality mechanism",
            "preparation penalty"
          ],
          "state_change": "The controlled term mechanism prediction joins the persistent glossary rail.",
          "claim_ids": [],
          "evidence_status": "conceptual"
        },
        {
          "beat_id": "b0012",
          "cue_id": "q0006",
          "start_s": 54.752,
          "end_s": 59.021,
          "primitive": "transform_compare",
          "visual_system": "support trace",
          "entities": [
            "EPFL parity result",
            "ex-circuit-cone",
            "instruction/operation equality mechanism",
            "preparation penalty"
          ],
          "state_change": "Trace cue q0006, 'When we say mechanism prediction, the highlight identifies its layer before we interpret it.', through support trace while the label for preparation penalty stays attached to its layer.",
          "claim_ids": [],
          "evidence_status": "conceptual"
        }
      ]
    },
    {
      "scene_id": "s003",
      "chapter_id": "c01",
      "composition_id": "cmp003",
      "purpose": "Advance definition through an inspectable state change.",
      "start_s": 59.021,
      "end_s": 85.102,
      "beats": [
        {
          "beat_id": "b0013",
          "cue_id": "q0007",
          "start_s": 59.021,
          "end_s": 64.148,
          "primitive": "transform_compare",
          "visual_system": "evidence panel",
          "entities": [
            "EPFL parity result",
            "ex-circuit-cone",
            "instruction/operation equality mechanism",
            "preparation penalty"
          ],
          "state_change": "The controlled term parity interval joins the persistent glossary rail.",
          "claim_ids": [],
          "evidence_status": "conceptual"
        },
        {
          "beat_id": "b0014",
          "cue_id": "q0007",
          "start_s": 64.148,
          "end_s": 69.275,
          "primitive": "transform_compare",